{
  "$schema": "https://json-schema.org/draft/2020-12/schema",
  "type": "object",
  "properties": {
    "$schema": {
      "type": "string"
    },
    "testDir": {
      "type": "string"
    },
    "runsDir": {
      "type": "string"
    },
    "testMatch": {
      "type": "array",
      "items": {
        "type": "string"
      }
    },
    "testIgnore": {
      "type": "array",
      "items": {
        "type": "string"
      }
    },
    "targets": {
      "type": "object",
      "propertyNames": {
        "type": "string"
      },
      "additionalProperties": {
        "type": "object",
        "properties": {
          "surface": {
            "type": "string",
            "const": "web"
          },
          "description": {
            "type": "string"
          },
          "baseUrl": {
            "type": "string",
            "allOf": [
              {
                "pattern": "^https?:\\/\\/[^\\s/?#]\\S*$"
              },
              {
                "pattern": "^(?![\\s\\S]*\\{\\{secrets\\.)[\\s\\S]*$"
              }
            ]
          },
          "secretSinkOrigins": {
            "type": "object",
            "propertyNames": {
              "type": "string",
              "pattern": "^\\{\\{secrets\\.[A-Za-z0-9_]+(?:\\.[A-Za-z0-9_]+)*\\}\\}$"
            },
            "additionalProperties": {
              "type": "array",
              "items": {
                "type": "string",
                "allOf": [
                  {
                    "pattern": "^https?:\\/\\/[a-zA-Z0-9](?:[a-zA-Z0-9-]{0,61}[a-zA-Z0-9])?(?:\\.[a-zA-Z0-9](?:[a-zA-Z0-9-]{0,61}[a-zA-Z0-9])?)*(?::(?:6553[0-5]|655[0-2][0-9]|65[0-4][0-9]{2}|6[0-4][0-9]{3}|[1-5][0-9]{4}|[1-9][0-9]{0,3}))?$"
                  },
                  {
                    "pattern": "^(?![\\s\\S]*\\{\\{secrets\\.)[\\s\\S]*$"
                  }
                ]
              }
            }
          },
          "locale": {
            "type": "string",
            "minLength": 1
          },
          "executor": {
            "type": "object",
            "properties": {
              "kind": {
                "type": "string",
                "enum": [
                  "playwright"
                ]
              },
              "browser": {
                "type": "string",
                "const": "chromium"
              }
            },
            "required": [
              "kind"
            ],
            "additionalProperties": false
          },
          "healReplayIsolation": {
            "type": "string",
            "enum": [
              "idempotent",
              "stateful"
            ]
          },
          "resolveTimeoutMs": {
            "type": "integer",
            "minimum": 0,
            "maximum": 60000
          }
        },
        "required": [
          "baseUrl"
        ],
        "additionalProperties": false
      }
    },
    "defaultTarget": {
      "type": "string"
    },
    "secrets": {
      "type": "object",
      "properties": {
        "allow": {
          "anyOf": [
            {
              "type": "array",
              "items": {
                "type": "string",
                "pattern": "^[A-Za-z0-9_]+(?:\\.[A-Za-z0-9_]+)*$"
              }
            },
            {
              "type": "string",
              "const": "*"
            }
          ]
        }
      },
      "required": [
        "allow"
      ],
      "additionalProperties": false
    },
    "ai": {
      "type": "object",
      "properties": {
        "provider": {
          "type": "string",
          "enum": [
            "claude",
            "codex",
            "auto"
          ]
        },
        "timeoutMs": {
          "description": "Deadline in milliseconds for one provider dispatch. Applies to every generate, run, and heal dispatch. The heal case deadline is an admission boundary only, so an admitted dispatch may still run up to this value. Default 600000.",
          "type": "integer",
          "exclusiveMinimum": 0,
          "maximum": 9007199254740991
        },
        "maxGenerateAttempts": {
          "description": "Maximum provider attempts per prompt during generate when the local validators reject a response. Between 1 and 5, default 2. Never applies to heal repairs.",
          "type": "integer",
          "minimum": 1,
          "maximum": 5
        }
      },
      "additionalProperties": false
    },
    "viewer": {
      "type": "object",
      "properties": {
        "port": {
          "type": "integer",
          "minimum": 1,
          "maximum": 65535
        }
      },
      "additionalProperties": false
    },
    "ci": {
      "type": "object",
      "properties": {
        "heal": {
          "type": "boolean"
        },
        "updateGroundingCache": {
          "type": "boolean"
        }
      },
      "additionalProperties": false
    },
    "grounding": {
      "type": "object",
      "properties": {
        "repositoryPolicy": {
          "type": "string",
          "enum": [
            "committed",
            "uncommitted"
          ]
        },
        "localWriteBack": {
          "type": "string",
          "enum": [
            "auto",
            "explicit"
          ]
        }
      },
      "additionalProperties": false
    },
    "heal": {
      "type": "object",
      "properties": {
        "maxStepRepairs": {
          "description": "Hard limit on real provider dispatches started during incremental repair. Charged at dispatch time regardless of outcome. Includes element confirmation dispatches. Excludes the cache-only baseline and Stage 3.",
          "type": "integer",
          "exclusiveMinimum": 0,
          "maximum": 9007199254740991
        },
        "caseTimeoutMs": {
          "type": "integer",
          "exclusiveMinimum": 0,
          "maximum": 9007199254740991
        }
      },
      "additionalProperties": false
    }
  },
  "required": [
    "$schema"
  ],
  "additionalProperties": false,
  "$id": "https://kotarotsubaki.github.io/ambercast/schemas/config.schema.json",
  "title": "ambercast config schema",
  "description": "Validates the parsed contents of a present Ambercast configuration file."
}
